{
  "id": "FB01",
  "packet_id": "MP-SIM-DES-r1",
  "experiment_id": "AX01",
  "collected_at": "2026-10-11",
  "channel": "operator_message",
  "attempt_status": "not_attempted",
  "actions_taken": "Opened the project folder once; a rush job for a repeat client took the week.",
  "observations": [],
  "effort_minutes_actual": 5,
  "prediction_comparison": "no_prediction",
  "surprises": "",
  "blockers": [
    "time"
  ],
  "blocker_note": "Rush job; 6 projects felt like a big sit-down.",
  "harm_report": {
    "occurred": false,
    "severity": "none"
  },
  "belief_update": {
    "direction": "unchanged"
  },
  "decision_change": {
    "status": "not_yet"
  },
  "usefulness_0_10": null,
  "goal_confidence_0_10": 3,
  "evidence_grade": "E0",
  "result_class": "not_applicable",
  "checkin_minutes": 4
}
